{
  "$schema": "http://json-schema.org/draft-07/schema#",
  "title": "Sijba Handler Config",
  "type": "object",
  "required": ["id", "direction", "type"],
  "properties": {
    "id": {"type": "string", "minLength": 1},
    "priority": {"type": "number"},
    "direction": {"type": "string", "enum": ["inbound", "outbound", "source"]},
    "category": {"type": "array", "items": {"type": "string"}},
    "lifecycle": {"type": "string", "enum": ["per_message", "persistent"]},
    "type": {"type": "string", "enum": ["exec_json", "exec_raw", "http"]},
    "required": {"type": "boolean"},
    "await_response": {"type": "boolean"},
    "allow_direct_inject": {"type": "boolean"},
    "continue_on_match": {"type": "boolean"},
    "match": {
      "type": "object",
      "properties": {
        "regex": {"type": "string"},
        "source": {"type": "array", "items": {"type": "string"}}
      },
      "additionalProperties": false
    },
    "exec": {"type": "string"},
    "args": {"type": "array", "items": {"type": "string"}},
    "stdin": {"type": "string"},
    "capture_stdout": {"type": "boolean"},
    "timeout_seconds": {"type": "number"},
    "context": {
      "type": "object",
      "description": "If set, core loads context from the store before invoking the plugin and saves context_update from the response.",
      "properties": {
        "namespace": {"type": "string", "description": "Store namespace (defaults to handler id)"},
        "key": {"type": "string", "description": "Field from source_meta to use as store key (default: chat_id)"}
      },
      "additionalProperties": false
    },
    "env": {
      "type": "object",
      "description": "Extra environment variables passed to the spawned process. Values support ${VAR} substitution from the host environment.",
      "additionalProperties": {"type": "string"}
    },
    "privileged": {
      "type": "boolean",
      "description": "If true, the handler is allowed to modify the sijba config directory and trigger restarts."
    },
    "router_hint": {
      "type": "string",
      "description": "Short description + example commands for the router LLM to understand when to route to this handler."
    },
    "receive_handler_context": {
      "type": "boolean",
      "description": "If true, core injects a 'handlers' summary (id + router_hint) into the envelope before invoking this plugin."
    },
    "shared_process": {
      "type": "string",
      "description": "ID of another persistent handler whose process to reuse instead of spawning a new one."
    },
    "startup": {
      "type": "object",
      "properties": {
        "url": {"type": "string"},
        "invoke_path": {"type": "string"},
        "health_path": {"type": "string"},
        "socket_path": {"type": "string"},
        "startup_timeout_seconds": {"type": "number"},
        "restart_policy": {"type": "string", "enum": ["always", "on_failure", "never"]}
      },
      "additionalProperties": false
    }
  },
  "additionalProperties": false
}
